{
  "claim_scope": "DISCOVERY_PRIOR_ONLY",
  "evaluation_guards": [
    {
      "architecture_affinity_hits": [],
      "candidate_archetypes": [
        {
          "change_axes": [
            "test distribution",
            "baseline parity",
            "memory accounting"
          ],
          "family": "evaluation-guard",
          "name": "held-out verification harness",
          "template": "Seal public smoke cases for discovery and reserve separate correctness, numerical, and memory cases for finalist verification."
        }
      ],
      "claim_boundary": "DISCOVERY_PRIOR_ONLY",
      "context_signature_hits": [
        "baseline",
        "correctness",
        "kernel",
        "memory"
      ],
      "expected_bottleneck_shifts": [
        "A candidate that appears faster under a weak harness may disappear after realistic numerical and memory constraints are restored."
      ],
      "failure_modes": [
        "Baseline and candidate use different numerical modes.",
        "Visible tests let the generator specialize away required generality.",
        "Latency improves by excessive temporary memory or invalid cached outputs."
      ],
      "family_hits": [],
      "implementation_recipe": [
        "Freeze baseline numerical modes, compilation settings, and measurement semantics before search.",
        "Keep hidden or held-out shape/value cases unavailable to candidate generation.",
        "Treat peak memory and prohibited fallback paths as first-class acceptance checks."
      ],
      "kind": "EVALUATION_GUARD",
      "method_id": "kernelbench-verified-evaluation",
      "missing_required_capabilities": [],
      "opportunity_signature_hits": [
        "kernel"
      ],
      "score": 7.0,
      "source": {
        "claim_scope": "Evaluation study of LLM-generated kernels; use as a harness-design warning rather than a transformation recipe.",
        "evidence_tier": "PRIMARY_PREPRINT",
        "title": "KernelBench-Verified: Do LLM-Generated Kernels Actually Beat PyTorch?",
        "url": "https://arxiv.org/abs/2607.16241",
        "version": "arXiv:2607.16241v1"
      },
      "title": "Guard kernel search against benchmark and correctness reward hacking",
      "transfer_status": "DIRECT",
      "validation_recipe": [
        "Rerun finalists on held-out distributions and adversarial numerical cases.",
        "Verify that the candidate performs the required work and does not exploit harness gaps.",
        "Report geometric or workload-weighted aggregate results with failures included."
      ]
    }
  ],
  "generated_at": "2026-09-05T06:01:03.888438+00:00",
  "input_identities": [
    {
      "path": "operator.json",
      "sha256": "1ecddd93460efc715c58fccbe8598465942550496fffaf01d5f99e7148f9dbea"
    },
    {
      "path": "workload.json",
      "sha256": "f212c52a98408deaf54c5517b457cf696f4b9235e3e515d1fb7a57f4b699bb73"
    },
    {
      "path": "hardware.json",
      "sha256": "965f9aab2d1db1219985f2d1dbe7b74bc34bb5b63e940dff647a2a2538ef5ea3"
    },
    {
      "path": "models/opportunity_map.json",
      "sha256": "2da621ef7942e2c1aa9b9a8847889ce82c234ceaca414e7ff16db937e8ff3f75"
    }
  ],
  "library_identity": {
    "cards": [
      {
        "path": "knowledge/methods/cuda-grid-stride-thread-reuse.json",
        "sha256": "5cd7fa5b8f0aedaeaf324ba26a84d202c9c682dd913e11b4f2966558eecbadd0"
      },
      {
        "path": "knowledge/methods/cuda-launch-occupancy-frontier.json",
        "sha256": "56e507159f6c2ba6ed2e3c44ebdfd645fdd7dda7de3bf408904773f431e5e2c4"
      },
      {
        "path": "knowledge/methods/cuda-vectorized-memory-access.json",
        "sha256": "9a99310b163b13e6a2b281a20b4e9e07d1add966cd82450561477bebdf896a51"
      },
      {
        "path": "knowledge/methods/flashattention3-async-pipeline.json",
        "sha256": "c24d0bb179f1898a2a96bfbfaf6446bff53ca49ed901e8b8ff416dad9c31383c"
      },
      {
        "path": "knowledge/methods/kernelbench-profile-feedback.json",
        "sha256": "28664055c653b16633d329d63ec8ae7ae9abee891c7ef5f75276005ea6c92b18"
      },
      {
        "path": "knowledge/methods/kernelbench-verified-evaluation.json",
        "sha256": "3c7021f4b9f3f3578a4271df1372ac312db51d9e3dacc5db970bcb5f0cc58be1"
      },
      {
        "path": "knowledge/methods/korch-fission-orchestration.json",
        "sha256": "b3160060d967df1cf81287daff070934631c9ff8c9a558e0fd5c2dc4f260e756"
      },
      {
        "path": "knowledge/methods/tilelang-schedule-dataflow-separation.json",
        "sha256": "98f80a3f60209cdd76d304d0b95494a453c432126b3fb8fda2b45392c109fe0b"
      },
      {
        "path": "knowledge/methods/triton-dynamic-extent-specialization-control.json",
        "sha256": "05319b7ffc3bc4204a6ce7da8b79daa425cd91d47d6b3fa77671edbc620b8c57"
      }
    ],
    "sha256": "32d6b6631bd64938f359709eeff22f31359e2e7210a0ce216179e6d971fd5822"
  },
  "policy": {
    "hardware_requirement_policy": "FAIL_CLOSED",
    "literature_claim_policy": "HYPOTHESIS_NOT_PERFORMANCE_EVIDENCE",
    "max_matches_per_opportunity": 3,
    "score_formula": "12*family_hits + 3*opportunity_signature_hits + min(2,context_signature_hits) + evidence_weight - 4*missing_capabilities - 2*adaptation - 100*incompatible"
  },
  "recommendations": [
    {
      "matches": [
        {
          "architecture_affinity_hits": [],
          "candidate_archetypes": [
            {
              "change_axes": [
                "mathematical decomposition",
                "fusion boundary",
                "intermediate ownership"
              ],
              "family": "operator-fission",
              "name": "fission then selective refusion",
              "template": "Split a compound stage into legal primitives, then fuse each primitive with the consumer that removes the most weighted materialization."
            },
            {
              "change_axes": [
                "launch count",
                "materialized bytes",
                "duplicated compute"
              ],
              "family": "cross-stage-fusion",
              "name": "weighted orchestration frontier",
              "template": "Implement a small Pareto set spanning minimal launches, minimal bytes, and minimal duplicated work."
            }
          ],
          "claim_boundary": "DISCOVERY_PRIOR_ONLY",
          "context_signature_hits": [
            "fusion",
            "operator"
          ],
          "expected_bottleneck_shifts": [
            "Removing launches and intermediates can shift the kernel toward register pressure or redundant computation.",
            "Fission can expose better fusion boundaries while increasing the orchestration search space."
          ],
          "failure_modes": [
            "Greedy fusion creates a large kernel whose occupancy or instruction cache behavior regresses.",
            "Fission duplicates expensive work or violates numerical ordering constraints.",
            "A locally faster stage produces an incompatible downstream layout."
          ],
          "family_hits": [],
          "implementation_recipe": [
            "Decompose compound operators into legal primitive regions before selecting fusion boundaries.",
            "Enumerate orchestration alternatives that include fission-plus-refusion, not only greedy adjacent fusion.",
            "Score each alternative on weighted end-to-end latency and materialized bytes under explicit compatibility constraints."
          ],
          "kind": "ORCHESTRATION",
          "method_id": "korch-fission-orchestration",
          "missing_required_capabilities": [],
          "opportunity_signature_hits": [
            "fusion"
          ],
          "score": 8.0,
          "source": {
            "claim_scope": "Tensor-program orchestration evaluated on V100 and A100; reported speedups do not transfer directly to other workloads or devices.",
            "evidence_tier": "PEER_REVIEWED_PRIMARY",
            "title": "Optimal Kernel Orchestration for Tensor Programs with Korch",
            "url": "https://arxiv.org/abs/2406.09465",
            "version": "ASPLOS 2024 / arXiv:2406.09465v1"
          },
          "title": "Explore fission before choosing global kernel orchestration",
          "transfer_status": "DIRECT",
          "validation_recipe": [
            "Preserve an unfused and a greedily fused control alongside the selected orchestration.",
            "Check every workload case because the best fusion boundary may be shape dependent.",
            "Attribute gains to removed launches/materializations and record any duplicated compute."
          ]
        },
        {
          "architecture_affinity_hits": [],
          "candidate_archetypes": [
            {
              "change_axes": [
                "architecture family",
                "opportunity coverage",
                "wall-clock allocation"
              ],
              "family": "candidate-portfolio",
              "name": "bounded architecture portfolio",
              "template": "Give each distinct family one build/correctness/smoke attempt, halve the portfolio, and spend deeper analysis only on survivors."
            }
          ],
          "claim_boundary": "DISCOVERY_PRIOR_ONLY",
          "context_signature_hits": [
            "baseline",
            "correctness",
            "kernel"
          ],
          "expected_bottleneck_shifts": [
            "Profiling should redirect search when an intended optimization moves the bottleneck elsewhere.",
            "Portfolio-level progress can improve even when individual candidate lines terminate earlier."
          ],
          "failure_modes": [
            "The agent repeatedly tunes launch parameters after the measured bottleneck has moved.",
            "Feedback is too verbose or unstructured to change the next architecture decision.",
            "The search overfits a public anchor input."
          ],
          "family_hits": [],